,video_id,video_title,upload_date,view_count,like_count,comment_count
0,RmQ5f5YQn58,"Маргинал, Антон ВХС и Силентиум советуют фильмы",2022-02-09,12223,629,74
1,ugaF4kqTA58,Маргинал и Кашин про ситуации на Украине и в Казахстане,2022-02-07,22325,929,402
2,AWCv-fm0a4o,Маргинал про противостояние России и Украины,2022-02-06,57659,2494,1180
3,JpyNNA7v0OM,Маргинал защищает американских деревенщин от левой пропаганды,2022-02-04,50879,2376,351
4,M2gSiQW4epo,Программист из Канады в гостях у Маргинала,2022-02-02,19397,951,302
5,_7UYWjxlBUw,Маргинал спорит со Световым про гражданские права,2022-01-30,44852,1765,353
6,tualeo6x6ro,Маргинал про рекламу на своих ресурсах,2022-01-28,29643,1074,173
7,OOV1foErSFo,Маргинал смотрит про американскую культуру,2022-01-26,69417,2836,398
8,ldJ6-TjaPWg,Маргинал учит LGBT+ флаги,2022-01-24,30903,1070,224
9,xRIBblABwZY,Маргинал про британские сериалы,2022-01-21,31543,1034,173
10,YHNS6so5hM8,Маргинал смотрит Скьёлда про Локи,2022-01-16,52312,1672,204
11,4YIeWdOMQLw,Маргинал и Каргин подводят итоги 2021 года,2022-01-11,21811,698,119
12,70NGTM0mpo4,Маргинал и Звонов спорят про материю и идею,2022-01-07,31252,1332,411
13,phbOX1IYVaw,Маргинал про фейковое величие Китая,2022-01-05,67550,2722,551
14,UyrvMBUBjSA,Маргинал отвечает на очередную критику своей позиции про аборты,2022-01-03,48282,2082,607
15,Ge0ecI5wz4A,Маргинал смотрит обзор на Час оборотня,2021-12-29,29564,1386,86
16,vtXHyM-46lQ,Маргинал судит дебаты про воинскую повинность,2021-12-27,45169,1850,470
17,jgF62UmIEMY,Маргинал спорит про жизнь в США,2021-12-25,91406,2560,466
18,hOkW_S2cJPk,Маргинал про работу на дядю,2021-12-24,58541,2282,628
19,PCVlza91_oI,Маргинал критикует тейки Красовского о пытках в тюрьмах,2021-12-22,50396,2112,286
20,-DdGQwVSkC0,Маргинал беседует с Упоротым Палеонтологом,2021-12-20,63139,2556,269
21,YOCT0vGRJF0,Мэддисон в гостях у Маргинала,2021-12-18,77192,2992,206
22,Yuy9xjkLghg,Маргинал бомбит на кинотеорию ЧБУ,2021-12-17,52824,2185,482
23,EPUDd1dtd68,Борис Бурда в гостях у Маргинала и Каргина,2021-12-15,35437,1517,293
24,MJJabqLu9Gc,Маргинал смотрит про фильмы с ДНК Чужого,2021-12-13,24101,842,57
25,g4bXNk9jOOA,Маргинал критикует Быкова за трактовку Витгенштейна,2021-12-11,36570,1048,128
26,VSe-8EppOlE,Маргинал бомбит от интервью Красовского с одержимой,2021-12-10,75234,2029,452
27,itY1iK9dcz8,Маргинал нашёл нового годного киноблогера,2021-12-08,47034,1958,157
28,4Fer1fLySro,Маргинал и Лекс Кравецкий про экономику и политику,2021-12-06,19722,912,142
29,rgegwELQY_A,Маргинал критикует ролик Тубуса про русский язык,2021-12-05,52739,1800,342
30,_Sueg9IZIXg,Маргинал вновь рофлит с Бэбэем,2021-12-03,34796,1972,144
31,dTk-DG8z5mQ,Маргинал смотрит Флинна про аналоговый хоррор,2021-12-02,26313,1268,99
32,f0bMp8j5z7M,Маргинал судит дебаты про владение огнестрельным оружием и самоборону,2021-12-01,56254,2695,380
33,YPYKT6SaRsY,Маргинал смотрит пупы #10,2021-11-30,53755,2381,101
34,EPNl3lsBGgA,Маргинал про суд над Риттенхаусом,2021-11-29,39283,2026,203
35,rwfY-yLoFog,Светлана Бурлак в гостях у Маргинала и Моргота,2021-11-28,32736,1592,174
36,oAT4YFTojyc,Маргинал угарает над конфликтом Стаса и Егора Потапенко,2021-11-27,90027,3479,587
37,oR7i0gntaeI,"Маргинал, Левин и Леман разбирают взгляды современных философов",2021-11-26,22372,740,94
38,ZLGtLBmWNqA,Маргинал про обречённость европейцев и уход в лес,2021-11-24,62814,2387,444
39,FNpsQZEHEAA,Маргинал смотрит про маньяков в России,2021-11-23,37182,1722,167
40,R9-Q4y5Zir0,Маргинал про ресентимент малых народов,2021-11-22,29640,1237,457
41,0VBU0Mmtp5M,Маргинал смотрит про карьеру Роба Шнайдера,2021-11-21,23390,903,73
42,cxsfD3V_-rI,Маргинал спорит про ислам и арабов,2021-11-20,56217,2203,379
43,H3uPHYTecUw,Маргинал смотрит про карьеру Мэла Гибсона,2021-11-19,34786,1256,122
44,rv3SaKhKptk,"Маргинал, Сармат и Алипов про сознание",2021-11-18,15253,551,53
45,3XiSMTUoOe8,Маргинал про свой опыт употребления травы,2021-11-17,36406,1294,212
46,RE3i7gSkRSc,Маргинал смотрит про франшизу Кошмар на улице Вязов,2021-11-15,29313,1189,105
47,3ZUOURZ3LqY,Маргинал разрешил парадокс всемогущества | Бог и неподъёмный камень,2021-11-14,34816,1558,462
48,UAla4Yae2WM,Маргинал про свободу слова и Хованского,2021-11-13,49987,2071,570
49,e4VMDwnMqKI,Маргинал оценивает подборку Хэллоуин фильмов от Долина,2021-11-12,30560,1086,157
53,TAL0Tr_Fc3s,Маргинал даёт советы начинающим ютуберам,2021-11-10,27547,1160,217
54,g28Mv2sHRZQ,Маргинал про фильмы Ритуал и Никто не уйдёт живым,2021-11-09,22315,753,75
55,Zuw7KtpGEAY,Маргинал спорит с Сарматом про атеизм,2021-11-08,35790,1684,318
56,6braTwfD2mU,Маргинал жестко про топ стримеров,2021-11-07,51989,1778,253
57,xf4QkvfX0j0,Маргинал и Бояршинов беседуют на тему антропологии,2021-11-06,32242,1517,173
58,c7lTiWmmVuE,Маргинал бомбит на постхорроры,2021-11-05,40515,1376,207
59,giceaD3T8dM,Маргинал смотрит Культаса про Стаса и Шевцова,2021-11-04,41625,1943,224
60,tvPttG7G5C0,Чибисов про формализацию психоанализа,2021-11-03,13924,616,67
61,JrOHtFfJ38E,Маргинал угарает с выпуска ProPolice,2021-11-02,35440,2152,177
62,ZiBLefz2ito,Маргинал и Малек Дудаков про политику США,2021-11-01,26059,1151,99
63,-y1w3uKrZhU,Маргинал про философию группы Nirvana,2021-10-30,51043,1853,409
64,CCmiMsHlcQ8,Маргинал про праиндоевропейский язык,2021-10-29,14817,612,59
65,uyfCbdRp_wc,Маргинал смотрит про фильм Шестое чувство,2021-10-28,22343,1017,66
66,e1ua0p0PQU4,Маргинал и Владимир Гарвард Оксфорд про высшее образование по удалёнке,2021-10-27,16206,733,67
67,Qbak7sxTKW4,Маргинал и Сармат спорят про бордели и индивидуалок,2021-10-26,29762,1094,261
68,M_0u0QQcJ1M,Маргинал угарает с мультика про Геракла,2021-10-25,30145,1492,215
69,vLbvCpDWu5w,Маргинал смотрит пупы #9,2021-10-23,89135,3702,173
70,kMofKqKp6d0,Маргинал и Сармат спорят про капитализм,2021-10-22,61713,2335,480
71,-Lgi4kYtWzo,Маргинал и Влад с канала Right History про РИ и СССР,2021-10-21,25083,1272,273
72,O1se1HU4Ci4,Маргинал вновь про запланированное устаревание,2021-10-20,27563,1095,217
73,SQmJ7g3w6ZA,Маргинал смотрит оценки на Панишера и Жмилевского в чат рулетке,2021-10-19,25132,1153,350
74,D57q9zmr4KQ,Маргинал про важность знакомств для работы и бизнеса,2021-10-18,25589,1414,268
75,DeXxm1yQvbA,Маргинал судит спор про трансгуманизм и ужасное будущее,2021-10-17,58680,2528,493
76,KlARiDOC1Cc,Маргинал комментирует лекцию по марксизму,2021-10-16,35736,1031,126
77,k0SAPrdS29E,Маргинал про свою депрессию и лень,2021-10-15,83841,3866,699
78,IxaIO0lmKNc,Маргинал смотрит критику Стаса на Шевцова,2021-10-14,126545,3445,800
79,NAPWCf8T1Vc,"Маргинал договорился, что атеистов не существует",2021-10-13,23566,1200,291
80,TsbU4zF2J84,Маргинал пояснил за свою антифилософскую позицию,2021-10-12,27997,1425,105
81,74LoUBLot8s,Маргинал угарает с русской локализации Рейнджеров,2021-10-11,34014,2828,154
82,LOz2AMNjM2Q,Маргинал судит дебаты за права лгбт,2021-10-09,56925,1859,308
83,CES04U8njD0,Маргинал поясняет Дробышевскому за геев,2021-10-08,46117,1671,523
84,GLtTakMoP5w,Маргинал жестко про рэп,2021-10-07,52565,2243,414
85,b1g0WHtUwgg,Маргинал смотрит про секс в Российской империи и США,2021-10-06,27109,1229,134
86,z4p-AewI-QM,Маргинал смотрит Сёмина про школьное образование в США,2021-10-05,46144,2087,190
87,S98_2wpE4oA,Маргинал про веру и традиционализм,2021-10-04,61048,1855,198
88,OSpGK3S6m_M,Маргинал смотрит Свой/Чужой про национализм,2021-10-02,35165,1554,230
89,uUp8KkRLIV8,Маргинал про запланированное старение в индустриальном обществе,2021-10-01,31190,1323,428
90,VSSJ12UbfOc,Маргинал спорит про chad охотников и virgin земледельцев,2021-09-30,31939,1456,417
91,jjD4RMn3cSE,Маргинал и Авигдор Эскин про Мировое еврейство,2021-09-29,16345,712,136
92,KbLKCKYQ2Hg,Маргинал смотрит оценки внешности Стаса в чат рулетке,2021-09-28,33610,2326,137
93,4kuU5NNU8Dk,Маргинал и Авигдор Эскин про 11 сентября и борьбу с терроризмом,2021-09-27,27509,1101,156
94,1SgkVYkrnvc,Маргинал смотрит пупы #8,2021-09-26,69821,3030,120
95,yUl17-Gs5VI,Маргинал про свидетелей повесточки,2021-09-25,42328,1563,490
96,WWSkj5hhvPo,Маргинал смотрит про деревню нацистов в Германии,2021-09-24,50412,2364,413
97,Itvz35F2vl0,Маргинал смотрит про Вальхаллу,2021-09-23,24388,1036,191
98,4jRH2WNRzMw,Маргинал про доносительство,2021-09-22,32967,1455,232
99,EvKPvhCODck,Маргинал смотрит про герундий (-ing),2021-09-21,16189,943,78
100,byqugIT9vtk,Маргинал смотрит разоблачение эксперимента Либета про мозг и сознание,2021-09-19,55228,2187,300
101,pAx5AsFYCho,Маргинал смотрит Понасенкова и Иванова про мифы,2021-09-18,38600,1222,66
102,dtOeG7_wngA,Маргинал про политические взгляды большинства людей,2021-09-17,103838,4436,733
103,JxL5hZEDok4,Маргинал смотрит про фильмы про эпидемии,2021-09-16,39880,1241,82
104,eSddBDef4tI,Маргинал смотрит лысого банкрота и монгола на Украине,2021-09-15,22070,690,229
105,OiiNnaOTkfw,Маргинал смотрит видосы по философии: онтология и деление на школы мысли,2021-09-14,24613,872,89
106,TXmU88Ze72w,Маргинал смотрит оценки внешности Ежи Сармата в чат рулетке,2021-09-13,26688,1224,131
107,jjoenifTQk8,Маргинал смотрит про фильм Хищник 2,2021-09-12,22686,963,44
108,qwU3zn0bprI,Маргинал критикует очередного коммуниста про неравенство при капитализме,2021-09-11,86131,2784,269
109,UG3-tXPZDjY,Маргинал смотрит и спорит про домашнее обучение,2021-09-10,68077,3198,727
110,ALP6cyr5M7o,Маргинал смотрит Дока про Отряд Самоубийц 2,2021-09-08,32214,1063,186
111,PtG7kpUyPP8,Маргинал раскрыл свою позицию про технику,2021-09-07,42715,1633,582
112,HRuOqr4lJ2M,Маргинал смотрит про восприятие слов на слух,2021-09-06,17868,546,108
113,PhGwW7kWKEo,Маргинал про будущее европейской культуры,2021-09-04,55000,2419,801
114,4TXVrWnmDsI,Маргинал про серию игр Dark Souls,2021-09-03,32782,790,458
115,Qq7SSE5P1kA,Маргинал пояснил за континентальную философию,2021-09-02,20369,1038,86
116,Ahh22IuICcs,Маргинал критикует видео про Масленицу и Крещение Руси,2021-09-01,57010,2191,252
117,BxrVcPE_LOI,Маргинал про способы изучения философии,2021-08-31,25101,1014,81
118,--C2jjvjOB0,Маргинал смотрит про политику в академической среде,2021-08-29,25986,876,122
119,Z1z54ne879c,Маргинал про ситуацию в Афганистане,2021-08-28,42725,1807,182
120,puWfxOwQOC8,Маргинал смотрит про морскую пехоту США,2021-08-27,24119,631,176
121,eOimxfJdSgM,Маргинал смотрит Бигу Егорова и его разоблачение на куклы Monster High,2021-08-25,28323,1595,272
122,d4xvc0aHViM,Маргинал и Кашин обсуждают политику,2021-08-24,35950,1452,187
123,qGpjYLZC954,Маргинал смотрит пупы #7,2021-08-23,122511,4114,127
124,cgnhz1AwZxg,Маргинал взлетает под звуки из ада,2021-08-22,29475,2557,306
125,z_eXP9-GXd0,Маргинал смотрит обзор на фильм Крик,2021-08-20,31249,1163,130
126,3O-iJkvRe3M,"Мирная беседа Маргинала, Каргина и Авигдора Эскина",2021-08-19,18125,780,327
127,ocgAtbFKraI,Маргинал отвечает на критику в свой адрес,2021-08-18,32052,1521,226
128,dTctunMBTWM,Маргинал смотрит про сверхчеловека в кино,2021-08-17,39680,1479,186
129,qtFE4RukoF8,Маргинал смотрит про двойные точки над гласными,2021-08-16,16475,878,49
130,fpawMd5jXQ8,Маргинал смотрит Красного Циника про Цвет из иных миров,2021-08-14,89631,2855,431
131,1dhDttvB7pM,Веллер в гостях у Маргинала и Каргина,2021-08-12,58627,3247,799
132,ldDs6osCeBQ,Маргинал смотрит обзор на советского Властелина кольца,2021-08-11,21954,861,67
133,ZdQRn6GXfXM,Маргинал смотрит про русскую тоску,2021-08-10,50569,2111,312
134,0d_NPKiLOBY,"Маргинал, Мэддисон, Вудуш и Флинн играют в Свою Игру",2021-08-07,136540,2975,256
135,VLvwxVcHgPc,Маргинал и Светов о политике и не только,2021-08-06,74475,2657,466
136,UXz9xmD-vp4,Маргинал смотрит про неудачные фэнтези-фильмы,2021-08-05,52405,1990,162
137,0QaX4KMjeVQ,Маргинал пояснил за лингвистику,2021-08-03,17195,906,78
138,mXldnySphog,Маргинал про свой путь донат-философа,2021-08-02,32246,1575,219
139,uW5wg-83Zo8,Светов и депутат Власов спорят о деле Хованского и судебной системе в РФ на стриме у Маргинала,2021-08-01,105474,4445,1756
140,z2iasm2Riyw,Маргинал угарает над славяно-арийскими письменностями,2021-07-31,181522,6244,392
141,FkcyoV9mg1g,Маргинал смотрит про фильмы по комиксам,2021-07-29,49855,1459,217
142,cpbPW6tevdM,Маргинал кринжует с родноверов,2021-07-28,53892,1742,347
143,ks1nikbrfbQ,Маргинальная политическая теория,2021-07-27,43053,1937,284
144,3fDy6xG4IZg,Маргинал и Сармат про европейские религиозные традиции,2021-07-26,27954,1175,164
145,7NUgbiVXES8,Маргинал спорит про аристократию и чувство прекрасного,2021-07-24,68026,2548,740
146,ZxtQbmiUlA8,Маргинал раскрыл секрет аниме,2021-07-23,44887,2127,913
147,x2dru0YLzxA,Маргинал рофлит с Бэбэем,2021-07-22,44544,1989,157
148,y0jzz9wkU64,Маргинал смотрит Дугина про Расколдованный мир,2021-07-21,36613,1803,170
149,AtaEhruozSo,Маргинал спорит с Дробышевским о природе человека,2021-07-19,73784,2402,437
150,11d1EKg0PtQ,Маргинал критикует бумера SiliconValleyVoice,2021-07-17,53345,1550,191
151,KaQ7ghUlIPE,Маргинал угарает с неграмотной журналистки,2021-07-16,49787,2052,268
152,jg6q0q7qCIg,Маргинал разбирает фейлы правых полит блоггеров,2021-07-15,39046,862,194
153,rZdJNGFqDkA,Маргинал пояснил за отличие иероглифов от букв,2021-07-14,31531,1885,219
154,ypmzDGdpS8k,Маргинал судит дебаты про смертную казнь,2021-07-13,97378,3398,642
155,a67spEkJldg,Каргин vs Шевченко про арабо-израильский конфликт,2021-07-12,13674,457,149
156,0Ys5r5OVqh4,Маргинал смотрит пупы #6,2021-07-11,77598,2486,89
157,Kfnuf9dXN9E,Маргинал против расизма противницы расизма,2021-07-10,61381,2105,429
158,OGCk9uVlDQ8,Маргинал смотрит расклад таро на себя,2021-07-09,58926,2110,426
159,M5xzSKlkvNM,Маргинал угарает с рофлов в Своей Игре,2021-07-08,61708,2459,132
160,veR-tyqNJP0,Маргинал пояснил за научность лингвистики,2021-07-07,18611,821,56
161,4MQu5zO6LgQ,Маргинал разбирает конфликт Гунера и Smile Face,2021-07-06,23083,736,324
162,2944DHrCVmc,D DON G в гостях у Маргинала,2021-07-05,33405,1965,244
163,3cDg_h2GtPQ,Маргинал про иррациональные поступки людей,2021-07-04,27934,1240,142
164,i3aYjg5jX9A,Маргинал определил тир-лист хорроров,2021-07-03,63313,1889,217
165,aqFtPRscxjE,Маргинал и Ватоадмин про налог на недвижимость,2021-07-02,28998,1281,115
166,G4hi2FBWl-k,Маргинал смотрит лекцию Маркова про современную эволюцию человека,2021-07-01,27015,1344,297
167,c-xfaNb4AU4,Маргинал смотрит криминальную психологию,2021-06-30,53338,1732,156
168,veV0ejFPUoY,Маргинал хочет отказаться от партнёрки твича | АСМР мета,2021-06-29,66446,2960,447
169,U54D3-dEUKU,Маргинал смотрит про гибель франшизы Чужого,2021-06-28,30355,1249,121
170,baYbAD760Yk,Маргинал защищает феминизм,2021-06-27,31588,1404,243
171,3p6IHBo6rlY,Маргинал смотрит пупы #5,2021-06-26,116801,3318,103
172,trbKcvtDznM,Маргинал и конфа спорят про концепцию постмодернизма,2021-06-25,24197,923,130
173,B9eLTb6ISms,Маргинал смотрит видео про неудачную смену пола,2021-06-24,58898,3099,406
174,LpeUu6aL5hk,Маргинал спорит с Сапольски про детерминизм и свободу воли,2021-06-23,44460,1367,301
175,y6OlNACfyeM,Маргинал про новые Пилу и Заклятье,2021-06-22,23090,875,82
176,YKW9p479U2A,Маргинал про смысл артхаусных фильмов,2021-06-21,31432,1243,270
177,s17Qqjp5y6c,Оля Розка в гостях у Маргинала | Деаноны и личные данные,2021-06-20,27261,787,267
178,iT6hP_NZhAI,Маргинал смотрит видео Флинна про пупы,2021-06-19,35652,1623,106
179,5CNOOjYEn1Y,Маргинал выбрал Путина вместо оппозиции а-ля Навальный,2021-06-18,82113,3354,545
180,xWP77G-tMKc,Маргинал выбирает между котами и собаками,2021-06-17,34128,1679,283
181,OpW4kgMNjJg,Маргинал смотрит видео про расизм в язычестве,2021-06-16,20594,663,90
182,LOEBuqoZJcg,Маргинал полчаса устанавливает кондиционер,2021-06-15,46834,2042,369
183,a-YSIf4tIGw,Маргинал смотрит Дугина про спорт и ЕГЭ,2021-06-14,21885,982,78
184,GVXX4Kl7MmM,Маргинал смотрит пупы #4,2021-06-12,128603,3955,177
185,c8nfOe6b1T4,Маргинал про арест Хованского,2021-06-11,109741,4991,866
186,eMrcVNr0XgQ,Маргинал и конфа про фильм Майор Гром и другие,2021-06-10,27602,1008,56
187,v5gU94Oarn4,Маргинал поясняет за детерминизм и свободу воли,2021-06-08,31070,1399,174
188,O2l2e8WaDKQ,Маргинал смотрит обзор на Неуязвимого,2021-06-06,46106,1624,227
189,CnvnwehvpEg,Маргинал про историю государственности России,2021-06-05,39275,1513,429
190,VOHxcNKTi7M,Маргинал смотрит пупы #3,2021-06-04,102120,3233,91
191,OTlJGmjdEUk,Сванидзе в гостях у Маргинала и Каргина,2021-06-02,18763,774,231
192,FI8lhY0V2PI,Маргинал смотрит GreenGrass про провалы Нечто и Алиты,2021-06-01,26848,998,101
193,TJeO6pBWT8I,Маргинал против снобизма в науке,2021-05-31,25238,1170,97
194,pHxTbNNw95I,Маргинал с похмелья смотрит Лысого банкрота в/на Украине,2021-05-30,24127,1024,99
195,VB6MVY5cBdA,Защита Савельева Redux 2.0,2021-05-29,30438,1038,168
196,ATcksKjIjx8,Маргинал опровергает тейки Vaush про Израильско-палестинский конфликт,2021-05-28,21675,903,148
197,akfbIe6pPN0,Маргинал смотрит пупы #2,2021-05-27,112635,3521,111
198,4t-DPL2i0zo,Маргинал защищает Дугина от нападок Шадова,2021-05-25,31112,1140,166
199,MeDoOWL1W74,Маргинал спорит про научные журналы и учёных,2021-05-24,22286,927,157
200,4TqDUJt2D28,Этнограф Михаил Членов в гостях у Маргинала,2021-05-23,35758,1692,323
201,jWovjOCZlVc,Маргинал кринжует от ролика Тхина про атеизм,2021-05-22,41492,1669,252
202,Ms8PsjKlTF0,"Круглый стол античной истории | Инквизиция, упадок Рима, крестовые походы, наука и философия",2021-05-21,28057,862,143
203,JwVXU_flUbo,Маргинал про конфликт Израиля и Палестины,2021-05-20,56256,2629,523
204,383UWXkKDLg,Маргинал слушает и поясняет за виски,2021-05-19,18769,461,60
205,qVEDRNILcI4,Росов неосторожно про Понасенкова и научность истории,2021-05-18,34631,1570,261
206,9jpt5sDQAAI,Маргинал сгорел от тейков Красного Циника про расизм,2021-05-17,72608,3039,348
207,piwg2nNi3jM,Маргинал про аниме и Голливуд,2021-05-16,27303,1096,319
208,yZnUA6ypnE8,Маргинал смотрит Скьёльда про Одина,2021-05-15,90171,2419,194
209,Ij5zEzfGfws,"Звонов, Алипов и Медик спорят о психиатрии на стриме у Маргинала",2021-05-14,27300,1056,177
210,h8RHKznvCGs,Маргинал со Всеволодом разбирают фрагмент Тхина про логику,2021-05-13,73047,1695,390
211,tOS9eMv0szU,Маргинал смеётся над пародиями на западных интернет знаменитостей,2021-05-12,21777,634,51
212,Z2q06_6xdHc,Маргинал смотрит Скьёльда про индоевропейскую прародину,2021-05-11,43599,1782,150
213,FuxoC33B6Qw,Поднебесный в гостях у Маргинала,2021-05-10,94141,3619,748
214,vS8grCKgzto,Маргинал про парад на 9 мая,2021-05-09,46498,1925,322
215,tOk6ZO1ptNE,Маргинал смотрит Вертолёта про Нику и Найк(и),2021-05-08,49986,2021,217
216,U5jzXFyeStY,Новая маргинальная конфа,2021-05-07,32523,1340,423
217,uhQFTfeL3Jc,Маргинал смотрит топ 5 sci-fi фильмов от JUST ILYA,2021-05-07,19557,911,86
218,S5ctDPE6KGg,Маргинал про языческое мировоззрение,2021-05-06,38585,1644,154
219,WeJf0r3nMro,Маргинал поясняет за марихуану,2021-05-06,50679,2186,374
220,zn0Z02sXmh8,Маргинал смотрит топ 10 мультфильмов от JUST ILYA,2021-05-05,35228,1246,131
221,LW9LyfziqTE,Маргинал защищает фильм Mortal Kombat,2021-05-04,25894,959,250
222,b8l6FrMbdYg,Реакция Маргинал на свою игру в cs:s,2021-05-03,35639,2512,111
223,NHpMeflIMXQ,Маргинал опровергает популярные марксистские тейки,2021-05-02,56121,1792,383
224,lyw_K5O_g64,Маргинал смотрит Флинна про ужасную атмосферу игр на Source,2021-05-01,52751,2358,119
225,oFuOMvlEdeY,Маргинал смотрит Стаса и Топлеса про религию,2021-04-30,131238,3039,274
226,iXDizDrV5rs,Маргинал без негатива про создательницу Сайхаба - Александру Элбакян,2021-04-29,32937,1280,301
227,gvK9ipopN5Q,Маргинал ударился в ностальгию по ТВ,2021-04-28,34004,1327,204
228,Mjecv78KRyU,Маргинал смотрит реакцию Стаса на критику Баженова,2021-04-27,165202,3106,360
229,pE7QT6gWhfI,Маргинал смотрит Озона #2​,2021-04-26,54872,1311,135
230,oNQZUhdSdkU,"Маргинал, Ватоадмин и Баженов про Стаса и коммунистов",2021-04-25,57417,1816,155
231,YfxFU_F2uks,Маргинал смотрит пупы,2021-04-24,224418,6583,216
232,htb7UjSp9EE,Маргинал раскрывает секрет похудения,2021-04-23,38066,1361,197
233,y2W2oIQiWIc,Маргинал против личного транспорта,2021-04-21,27310,1106,433
234,KaOyNYCHoSk,Маргинал угарает с бородача и его дермароллера,2021-04-20,40723,1557,166
235,cfayI1IffUE,Росов и Каджит определяют Россию будущего,2021-04-19,17651,657,151
236,aiDoPz2ernQ,Маргинал познал объёмное мышление,2021-04-17,50499,1871,246
237,_vip_vdoE7I,Маргинал защищает права трансгендеров,2021-04-16,40801,1441,556
238,a3sNi6HcGiw,Маргинал раскритиковал ролик про Шопенгауэра,2021-04-15,46174,1567,142
239,nFCBoSMUAZ8,Маргинал про долг перед обществом,2021-04-14,68714,2227,402
240,MLAbufmPwEA,Маргинал и маэстро Понасенков встретились,2021-04-13,487980,15831,1045
241,pov9qoji1_8,Маргинал защищает Дугина от нападок Понасенкова,2021-04-12,72077,2137,463
242,61Es32bC-wY,Маргинал в шоке от тейков Найшуллера и Поперечного про гражданское оружие,2021-04-10,73308,2458,431
243,5RdtFO2SAJQ,"Маргинал, Силентиум и Just Ilya про фильмы: Рассвет мертвецов, Хранители, Снайдеркат",2021-04-09,28507,720,92
244,lO8xwsEB990,Маргинал защищает Толкина от расизма Шульман,2021-04-08,78036,3060,342
245,LHt98rfsPec,Маргинал и Дарья Платонова о политике и религии,2021-04-07,46889,1714,325
246,v3OKLLZHY0c,Маргинал смотрит Падение Дона Савельона,2021-04-06,77531,2894,98
247,NQoJ0BYI75A,Маргинал опровергает тейки за существование Бога,2021-04-05,66788,1540,320
248,Ktmm-SGvdAo,Дебаты Росова и Каргина на тему противостояния Карфагена и Римской империи,2021-04-03,20009,700,220
249,kA-spp0h_Fo,Маргинал посмеялся с Дока и пояснил за Собор Молдбага,2021-04-02,28566,1047,182
250,jkd6A5RW-cg,Маргинал судит дебаты Сармата и Рудого,2021-04-01,97555,2313,235
251,FZoGCyBQneo,"Маргинал, Ларин и Каргин про моральные качества блоггеров на ютубе",2021-03-31,26409,857,64
252,YDQf-57ZzsA,"Маргинал и Силентиум обсуждают фильмы Чужой: Завет, Пекло и Пандорум",2021-03-30,33796,925,95
253,byxkeTosh50,Маргинал рассказал про инцидент с креслом,2021-03-29,28781,1107,112
254,zKw2em8DaSA,Маргинал плачет от интервью Собчак со Скопинским маньяком,2021-03-28,183788,5233,1245
255,-vMvOWTDN7U,Маргинал смотрит самые лучшие дебаты про феминизм,2021-03-27,40348,1527,170
256,0QI44jnq_Ls,Маргинал и Бояршинов про русскую народность,2021-03-26,16392,669,162
257,2GkVUa6VE4Y,Главный раввин Воронежа в гостях у Убермаргинала,2021-03-25,7421,257,49
258,keHPJLhsJg8,Маргинал уничтожает пранки,2021-03-24,29415,847,223
259,Nw8vzAurysM,Маргинал смотрит видео про девушку-снаряд,2021-03-23,26546,742,127
260,ApxZMLMU6lU,Маргинал и Медик про наркотики и проблемы с ними,2021-03-22,17499,739,74
261,vSIpmLTior4,Маргинал определяет жанр Sci Fi,2021-03-22,14874,623,91
262,rau7FOl8OGs,Маргинал и Вахштайн определяют понятие науки,2021-03-21,29035,1298,170
263,qIW_r0eZ_bk,Марго смотрит Ивана Гамаза,2021-03-20,26673,854,76
264,NQHJa3DlzYc,Мария с паблика Подручный в гостях у Убермаргинала,2021-03-20,11656,294,113
265,joRYgvY4xMY,Дебаты Лусинэ и Кота Васьки на стриме у Маргинала,2021-03-19,25246,764,126
266,HN9_gEkQX00,Маргинал про игры и рекламу на стримах,2021-03-18,17307,658,142
267,7vN7v3Ub8Yo,"Марго смотрит Женщины в хорроре: советую фильмы, снятые женщинами",2021-03-17,32833,1097,232
268,Orn1QCng-9Y,"Маргинал, Созидатель и Вудуш в Своей Игре",2021-03-16,22273,599,92
269,BpnijEvLedE,Маргинал против консолей,2021-03-16,19778,906,291
270,0hqcQMMDiNs,Маригнал и Коган про оружейные законы в РФ и США,2021-03-15,11211,545,69
271,eF0de4zpihc,Маргинал судит дебаты Минаева и Маршенкуловой,2021-03-15,30917,1103,186
272,HOy6uRH0vVo,Маргинал про поддельный снег в Техасе,2021-03-14,36773,1848,182
273,ZiUWwqTtV6Y,Маргинал против школьной программы математики,2021-03-13,21539,980,170
274,Ryjvq2joexw,Маргинал не комментирует интервью с Дугиным,2021-03-12,30909,832,89
275,3RB7x2b3hYg,Загадка про кино от Убермаргинала,2021-03-12,12695,608,50
276,rrNy-EEM1hc,Дебаты Давида Хомака и Александра Каргина на стриме Убермаргинала,2021-03-11,42930,1697,464
277,NvuLS8O44hE,Анатолий окунается в тренды ютуба,2021-03-10,50821,2470,198
278,pS2A88vLCrQ,Маргинал поясняет за античный гомосексуализм,2021-03-09,41464,1940,100
279,g4UYrAwBF4I,Маргинал и Коган беседуют о виски,2021-03-08,9844,332,28
280,1JfLoZz14C8,Как правильно вытирать жепу?,2021-03-07,18853,1063,184
281,1ZIjgxQIXpI,Бабуля Хиккана в гостях у Убермаргинала,2021-03-06,16477,975,118
282,ZVzpkoafLrw,Маргинал про overproduction Книжного чела,2021-03-05,20017,718,68
283,z-cJ-Gg3o4Y,Полное уничтожение аниме от Убермаргинала,2021-03-04,51202,1560,578
284,-HKAN9G-GXk,"Марго смотрит выдр, енотов и вялого льва",2021-03-03,11097,394,51
285,EmtrME6Jofg,Маргинал опять смотрит Людмилу и Гобзавра,2021-03-02,18875,632,62
286,kIobxzli7U4,Маргинал и Сармат про христианскую этику,2021-03-02,10377,400,42
287,lwgQF4yznuk,"Кот Васька, Николай Росов и Влад Панишер в гостях у Убермаргинала",2021-03-01,48898,1342,392
288,X7ZnlJZuySQ,Маргинал смотрит гайд по похудению с помощью пищевой плёнки,2021-02-27,24876,827,103
289,VKPb6la9MPI,Маргинал смотрит про контринтуитивность в кинематографе,2021-02-27,15953,524,96
290,ng4ztC90F_s,Математическая беседа с Всеволодом из Японии,2021-02-26,8599,337,39
291,YCNA4mgQF2w,Орегонский хайкинг с Убермаргиналом,2021-02-25,28567,1048,217
292,z_zAmcK-9wU,Юрист Лиза в гостях у Маргинала. Деаноны и прочее,2021-02-25,14917,437,93
293,T46qwWfHKj4,Маргинал и Олег Кашин определяют кто мурзилка,2021-02-24,16513,495,69
294,Wc-zLkAJJbs,Мир фентези с Убермаргиналом,2021-02-23,27660,1091,129
295,WL3vRBrd-RI,"Мини-вебинар по этике | Хайлайт, который никто не посмотрит",2021-02-23,10498,601,79
296,NTP3ooyXz_g,Маргинал вновь защищает позитивизм от марксиста,2021-02-22,10881,365,25
297,Zufpc47wVDg,Анатолий собирается в поход. День 1. Выбор снаряжения и сотовой связи,2021-02-21,20676,807,102
298,QfE-RTopZXY,Медик Александр в гостях у Анатолия (04.02.2021),2021-02-20,15340,543,54
299,tJXPixSuYQ8,Русский язык как Gay Lisp в английском / Реакция Анатолия,2021-02-19,20221,827,71
300,1Q7Ur-CHDwg,"Семантика возможных миров | Маргинал, Левин, Левшин, Леман",2021-02-18,11631,481,37
301,cKKMmQw6x5o,Шесть демонов Продюсера иванова,2021-02-10,38332,1053,138
302,K9mAcWa_ows,НАШ ЛЮБИМЫЙ КУКЕЧ,2021-01-25,38053,2051,79
303,Qd93o8I4yR8,Маргинал на Паучительных,2021-01-18,32100,784,44
304,ih6uh1ATZdY,Маргинал на Паучительных [10.01.21],2021-01-11,33190,803,20
305,RfXhp7QUHzo,Пельменные дебаты [03.01.21],2021-01-06,11125,336,43
306,cfweoNhXpEw,Маргинал и видосы на Паучительных историях,2020-12-28,33609,1035,26
307,OTCeuLV4zMw,Маргинал смотрит видосы в гостях на Паучительных историях,2020-12-21,24736,945,16
308,BBq2JbcqQzk,Абьюзивный кукеч в гостях на Паучительных,2020-12-08,11204,358,32
309,y6-zKiDzgq4,Похмельный кукеч в гостях на Паучительных,2020-12-06,8824,304,24
310,r5yHVbG8dq4,Маргинал в гостях на Паучительных | Аудиокнига Озона,2020-12-02,10770,340,29
311,YBFrKfyt8aM,Стрим памяти Жванецкого,2020-11-23,7316,211,24
312,uQyXt2_DXIU,Маргинал смотрит видосы в гостях на Паучительных [15.11.20],2020-11-16,9646,227,19
313,TTt0_PO8rrs,Маргинал смотрит видосы в гостях на Паучительных,2020-10-19,20406,515,73
314,UufM1dqM9OQ,Маргинал смотрит видосы в гостях на Паучительных,2020-10-19,5091,116,4
315,d6XGJkRBzzc,Маргинал смотрит видосы в гостях на Паучительных,2020-10-19,4194,112,2
316,h6af7bY-RKc,Маргинал смотрит видосы в гостях на Паучительных,2020-10-19,8800,263,3
317,1q1UVBNrks0,Маргинал смотрит видосы в гостях на Паучительных,2020-10-18,21650,740,13
318,SywZ8cFjELI,Маргинал смотрит видосы в гостях на Паучительных,2020-10-12,21272,783,23
319,Zr7g0QCRcwM,Маргинал дебатирует с католиком в гостях на Паучительных,2020-10-05,33448,1288,214
320,SetWJwvqhTQ,Маргинал смотрит видосы в гостях [25.09.20],2020-09-26,13149,349,30
321,1o8OcsJAjTc,Маргинал смотрит видео в гостях на Паучительных историях,2020-09-21,28685,831,38
322,NGw44Uy4E-0,Убермаргинал смотрит топовый пуп и всратого льва,2020-08-22,97587,3304,105
323,olIkSbeTLjU,Маргинал смотрит видосы в гостях на Паучительных историях,2020-08-05,22128,579,39
324,Y12MWLYnipc,Маргинал смотрит видосы в гостях на Паучительных историях,2020-06-14,27828,656,24
325,p3wnuruA45U,Ведущий мафии про гейство Убермаргинала,2020-05-23,25437,823,71
326,led-76eXG-s,Безумно можно быть первым...,2020-05-12,198641,5729,257
327,1kkZZhlrwlE,Спонсорство для желающих смотреть записи стримов с твича на ютубе,2020-05-02,4490,NULL,35
328,N7F6FnQ6WMA,Смотрим видео (долгожданный стрим),2020-05-01,15829,485,35
329,IGtqCwpZCi8,"В гостях Ubermarginal, HoneyMad и Власов.",2020-04-23,28315,1604,87
330,J6rSVp6_2Co,Дистанционное обучение на карантине вместе с паучительными историями!,2020-04-15,15303,388,37
331,4F5Qh7FPckk,🔴В гостях лингвист UeberMarginal. Сидим🔴,2020-04-02,9040,264,17
332,rORbXtQ4vSo,🔴В гостях лингвист-паук UeberMarginal. Смотрим видосы.🔴,2020-03-21,13969,480,16
333,By9yybf7q-o,В гостях лингвист из США UeberMarginal. Общаемся. Стрим из поезда. 3 марта 2020,2020-03-04,15048,280,18
334,lAlnBq6OZ3k,Просмотр видео. В гостях лингвист из США UeberMarginal. 29 февраля 2020,2020-02-29,4713,105,4
335,LHQbHbSDO8s,Просмотр видео. в гостях лингвист UeberMarginal. 28 февраля 2020,2020-02-28,8703,201,18
336,GgeF_ORFE14,Апдейты по сходке UeberMarginal и Продюсер Иванов. Видосы пойдем смотреть на GG чуть позже. 27.02.20,2020-02-27,5790,127,14
337,K4iArbCcOzg,[внеурОчка 27.02.2020] Обсуждаем сходку. В гостях UeberMarginal и @ProducerIvanov Professor Ivanov,2020-02-26,5951,149,7
338,u_wEOy9fN1Y,"В гостях Михаил Пожарский, UeberMarginal и видосы. 25.02.2020",2020-02-26,24040,695,30
339,utcFz7hvfKU,Просмотр видео 20.02.2020. В гостях лингвист из США UeberMarginal.,2020-02-21,16197,384,13
340,AcgEaiBhWAE,Просмотр видео. В гостях лингвист из США UeberMarginal. 18.02.2020,2020-02-19,17459,410,10
341,44fORmWCQSA,"Просмотр с UeberMarginal. Видео: Васил, @Юрий Хованский, @iKakProsto2 и Ислам vs Атеизм. 11.02.2020",2020-02-12,22687,597,26
342,CxuBPNemgnA,Просмотр видео. В гостях лингвист из США UeberMarginal. Ответ @Red Cynic. 7 февраля 2020,2020-02-07,18047,496,24
343,BHsDPShuAQQ,Просмотр видео. В гостях лингвист из США UeberMarginal. 5 февраля 2020,2020-02-05,15064,349,9
344,AuWlzbSOp80,Просмотр видео. В гостях лингвист из США UeberMarginal. 29 января 2020,2020-01-29,14983,333,12
345,yfsX07Z8b1Y,В гостях лингвист из США UeberMarginal,2020-01-28,2269,37,0
346,kTvZPTECIRU,Просмотр видео. В гостях лингвист из США UeberMarginal. 24 января 2020,2020-01-24,17145,380,27
347,fb9F-XbYtIU,Просмотр видео 22.01.2020. В гостях UeberMarginal,2020-01-22,18489,371,12
348,U1h3rTDUWXU,"В гостях девочка с каре, Ватоадмин и Убермаргинал. 17.01.2020",2020-01-17,26463,619,84
349,eSs9m2JjuHM,Просмотр видосов. В гостях Убермаргинал. 14 января 2020,2020-01-15,18759,438,16
350,LmiQhb9SPu4,Просмотр видосов на Паучительных. В гостях UeberMarginal,2020-01-08,19799,457,20
351,NGnJkCF6Qy8,Просмотр видосов на Паучительных. В гостях UeberMarginal,2020-01-07,5981,125,1
352,uUJCf12wL6g,В гостях UeberMarginal. Отвечает на вопросы из чата. 2 января 2020,2020-01-02,16155,438,16
353,lVIwz1qdMKE,"Сериал Ведьмак. В гостях Убермаргинал, Каджит и Ватный Либерал. Обсуждаем всё. 29.12.2019",2019-12-29,15777,492,34
354,Q7eoi9C59OM,🔴В гостях Убермаргинал. Просмотр видосов🔴,2019-12-19,10182,233,34
355,IyTA7ePliwQ,Субботний вечер на Паучительных. Просмотр видосов. Убермаргинал,2019-11-24,19607,490,11
356,oAddgvyfPfk,Разговор с плебеями. Конференция Маргинала (Апостол и Панишер). Субботний вечер,2019-11-17,16165,365,23
357,UrGVuV8cBE0,Вова Золотой и Убермаргинал. Субботний вечер на канале Паучительные истории,2019-11-16,8703,258,17
358,Ryn_lcipMR0,Ueberdebate #8: Сакрамар vs ASTRA. Супрематизм против сатанизма.,2019-11-12,45839,1190,89
359,Xwd7su5dyio,Обсуждаем рукастых историков вместе с Каджитом,2019-11-10,25399,728,105
360,FMkUfjOg-o4,Смотрим видосы с Маргиналом. Красный Циник Чернобыль (07.11.2019),2019-11-08,18825,488,30
361,9TBFx0TWZ2I,"Философия с Маргиналом, Сергеем Левиным и Богданом Фаулем (05.11.2019)",2019-11-05,13567,458,16
362,6Uzq1HhGJSc,Ueberdebate #7. Атар Зуренхай vs Борис Морозов. Свобода индивида при социализме (03.11.2019),2019-11-03,9304,276,20
363,xlj-MK4EHXk,Смотрим видосы с Убермаргиналом (29.10.19),2019-10-30,22545,545,16
364,mC-bqLdSzQI,Ueberdebate #6. Сакрамар vs анкап Лёша «Камендант» Терещук (22.10.2019) #2,2019-10-23,19460,526,87
365,uHxtFpzKyUM,Ueberdebate #6. Сакрамар vs анкап Лёша «Камендант» Терещук (22.10.2019) #1,2019-10-22,19644,776,30
366,vrBqVbKG_C4,Коллективный смотр видосов (19.10.2019),2019-10-20,20637,578,23
367,Rqz6a6bCJXg,Ночной подгон. Разговор подписчиков с Маргиналом через Дискорд (18.10.2019),2019-10-18,10261,247,23
368,1tGYukx6Qng,Ueberdebate #5. Дебаты о феминизме: Димитрий Крихан vs Илья Лазарев из Заговор Искусств (17.10.2019),2019-10-17,11419,443,36
369,V5J4HDCNq6o,Похититель Ароматов (15.10.2019),2019-10-16,60544,3281,108
370,r7wGTO3JizA,"Маргинал, Каргин, Капитан Влад, Бурятка (12/10/19)",2019-10-13,16075,480,32
371,XgzRtXT4JVc,Ueberdebate #4. Рома Механик vs. Дмитрий Скрынник. (+ Сакрамар и Капитан Влад),2019-10-09,111281,3124,366
372,vk8sB20Mt5o,Убермаргинал и Жмилевский смотрят видосы (01/10/2019),2019-10-01,25421,710,32
373,ioxZMKLD4Tc,Ueberdebate #3. Васил vs. Даниил Григорьев. Этика против экономики (24.09.2019),2019-09-25,22074,758,104
374,Gp5XFvJqUoo,"Ueberdebate #2. Зелёноадмин,  kinoOmich, Погром, Влад, Витюня. Урбанистика",2019-09-19,18639,607,73
375,IwVZWuhO39E,БумерМаргинал в гостях на Паучительных Историях,2019-09-18,10940,260,21
376,N_7n0aZ41go,Ueberdebate #1. Нейробиолог Владимир Алипов vs. Веган Илья Ильин. Вегетарианство — польза или вред?,2019-09-17,25477,998,194
377,FDlp9FDGK5g,Ueberdebate #0. Сакрамар vs Beautiful Monster. Способны ли женщины создавать как мужчины?,2019-09-14,24433,1237,50
378,8I4JgrTexcQ,Ueberdebate #0. Сакрамар vs Beautiful Monster. Способны ли женщины создавать как мужчины?,2019-09-14,23597,1183,74
379,aRlXhk1-68I,Убермаргинал в гостях на Паучительных историях (12.09.2019),2019-09-13,17410,544,26
380,GHfap1Z_VHA,Олег Кашин и Убермаргинал в гостях на Паучительных историях (10.09.2019),2019-09-11,25314,781,33
381,eJ_IxmUEvRQ,"Храбров у Бояршинова #2. Смотрят Убермаргинал, Жмилевский и др. (07.09.2019)",2019-09-08,27125,772,27
382,PGKCJJypEfk,Убермаргинал в гостях на Паучительных историях (04.09.2019),2019-09-04,11549,457,24
383,eoVNEc04STQ,Новое правительство и Верховная Рада Украины: первые изменения и перспективы (стрим Жмилевского),2019-09-02,7924,234,7
384,DvCTf4IjhoU,Международно правовая специфика территорий [Удалённый стрим Жммилевского],2019-08-31,1480,31,2
385,r6JTSt1Esy0,"Жмилевский, Smile Face и Minecraft [Удалённый стрим]",2019-08-31,8310,201,28
386,HBgVAfbxIZ8,"Общения Маргинала со зрителями, потом аукционы (29.08.2019)",2019-08-30,14595,401,18
387,fBJFpSk5WuU,Убермаргинал снова в гостях на Паучительных историях (24.08.2019),2019-08-24,16402,633,21
388,UrkXlNeVWKU,"Пытаемся добить Grand Theft Auto V, а после игро-фильмовые аукционы (игорстрим Жмилевского)",2019-08-24,3361,120,0
389,C1l8NR1VnA4,Ассоциированные государства как отдельный феномен эпохи деколонизации (стрим Жмилевского),2019-08-22,5369,246,8
390,oazSdl0Va-g,Иран: специфика государственного строительства и последние международные события (стрим Жмилевского),2019-07-31,5200,167,8
391,OEFINLYlqls,Международно-правовая специфика территорий: введение в курс (стрим Жмилевского),2019-07-28,3056,204,1
392,xhOHEyGei7E,Россия и США: извечные проблемы всепоглощающей геополитики (стрим Жмилевского),2019-07-27,6168,202,5
393,4-1Zyy4_H9U,"Пажилые ограбления в GTA 5, после которых игро-фильмовые аукционы (игорстрим Жмилевского)",2019-07-26,5999,143,1
394,W4FeNrHfvEI,Последние изменения по Brexit: новый премьер и старые проблемы (стрим Жмилевского),2019-07-25,4603,153,1
395,6zvHuMlUFWc,Election Night на ЁБНЕМ_TV: парламентские выборы на Украине (стрим Жмилевского),2019-07-21,6087,244,2
396,-hozojwAzKI,Игро-фильмовые аукционы (стрим Жмилевского),2019-07-20,1034,36,0
397,ZffiNGGFMjg,Начинаем Grand Theft Auto V (как только скачается) и игро-фильмовые ауки (игорстрим Жмилевского),2019-07-19,7382,239,4
398,qjwz6UWWS5U,Арабская весна: тектонический сдвиг геополитических плит и его последствия (стрим Жмилевского),2019-07-18,5837,202,5
399,LjRlIr4bzY4,Ян Бибень в гостях у Жмилевского (14/07/19),2019-07-15,2407,68,3
400,TIbT4RCrYmE,ДЕБАТЫ ЖМИЛЕВСКОГО И ВАСИЛА НА ТЕМУ КРЫМА (14/07/19),2019-07-15,17911,472,58
401,90k_NG4EDnw,Беседа с представителем движения Шахар Александром Каргиным (стрим Жмилевского),2019-07-13,5477,196,6
402,olZSDQh1Y6c,Беседа с представителем движения Шахар Александром Каргиным (стрим Жмилевского),2019-07-13,1277,40,1
403,-ZwPaVnF_8A,"Star Wars: Knights of the Old Republic, а после игро-фильмовые аукционы (игорстрим Жмилевского)",2019-07-12,3517,108,3
404,RArC_QEAhTQ,"Star Wars: Knights of the Old Republic, а после игро-фильмовые аукционы (игорстрим Жмилевского)",2019-07-12,1357,57,1
405,TnJJPYG6iBA,ДНР и ЛНР: предпосылки появления и перспективы на будущее (стрим Жмилевского),2019-07-11,14895,420,52
406,IV8owZizAxo,Каталония: борьба за независимость и отношения с Испанией (стрим Жмилевского),2019-07-10,3743,157,3
407,b3WZyGvttag,Украина: политические партии и их перспективы в преддверии парламентских выборов (стрим Жмилевского),2019-07-07,NULL,NULL,NULL
408,qQ-CzV3A9f4,Украина: политические партии и их перспективы в преддверии парламентских выборов (стрим Жмилевского),2019-07-07,NULL,NULL,NULL
409,pj6-47Td_cU,Сирийский конфликт: ход событий и современное состояние (стрим Жмилевского),2019-07-06,NULL,NULL,NULL
410,pRpcpH3Ip1E,Сирийский конфликт: ход событий и современное состояние (стрим Жмилевского),2019-07-06,NULL,NULL,NULL
411,yZxakCzW-7E,"Пытаемся добить Sleeping Dogs, а после игро-фильмовые аукционы (игорстрим Жмилевского)",2019-07-05,3236,111,1
412,JvnOkClD1ZU,Сирийский конфликт: возвращение классического двухполярного противостояния (стрим Жмилевского),2019-07-04,NULL,NULL,NULL
413,UDDeMNKMfwU,"В 19:00 ожидается Илья Николаевич и Павел Гум, а пока пажилой шпионаж в Jazzpunk (стрим Жмилевского)",2019-07-03,NULL,NULL,NULL
414,W5wLBzlCm9Y,Карабахский конфликт: разделение территорий как бомба замедленного действия (стрим Жмилевского),2019-06-30,NULL,NULL,NULL
415,EiSI90QARQ0,G-20 и переменные результаты в международном экономическом сотрудничестве (стрим Жмилевского),2019-06-29,3235,118,2
416,NcnYLdOlGRY,2 стрима за один день? Да быть того не может: а ну давай аук (стрим Жмилевского),2019-06-29,2706,101,7
417,r2F0iL-ID-k,Ping-Pong продолжается: Sleeping Dogs и игро-фильмовые аукционы (игорстрим Жмилевского),2019-06-28,4652,155,3
418,Mo4BgUdFjec,"ПАСЕ (и весь Совет Европы): так это, оказывается, нужно России? (стрим Жмилевского)",2019-06-27,3035,121,4
419,cBYQ2RKIdow,Приднестровье: пособие по выживанию замкнутых территорий (стрим Жмилевского),2019-06-23,6389,223,9
420,HTeCLsA9kXY,Россия и Грузия: бесконечный кризис в контексте прагматичных связей (стрим Жмилевского),2019-06-22,6439,199,18
421,KZEpuiQN2mk,Россия и Грузия: бесконечный кризис в контексте прагматичных связей (стрим Жмилевского),2019-06-22,3851,148,2
422,GD5XljE_tYE,Пажилые сапёры идут до победного: Keep Talking and Nobody Explodes и ауки (игорстрим Жмилевского),2019-06-22,3614,142,0
423,fP2CbDZOpEw,Пажилые сапёры идут до победного: Keep Talking and Nobody Explodes и ауки (игорстрим Жмилевского),2019-06-21,1379,92,0
424,vCv7ORWPTLc,Обсуждаем итоги прямой линии с Владимиром Путиным (стрим Жмилевского),2019-06-20,14586,515,8
425,acxKN1esjYQ,Украина: досрочные парламентские выборы и решение Конституционного суда (стрим Жмилевского),2019-06-19,NULL,NULL,NULL
426,OaYUWEoiCfE,Пажилые сапёры в Keep Talking and Nobody Explodes (стрим Жмилевского),2019-06-15,NULL,NULL,NULL
427,0s6RgAR7_qE,Ping Pong in Hong Kong: Sleeping Dogs и игро-фильмовые ауки (игорстрим Жмилевского),2019-06-15,4707,148,0
428,U60W6TN14lA,Тупа чиллим и общаемся под Beholder 2 (стрим Жмилевского),2019-06-13,4221,150,1
429,uWMjyR-P4Rs,Последние события в Молдавии: двоевластие как итог политической агонии (стрим Жмилевского),2019-06-12,4329,148,2
430,4ksRKxEM5VQ,"Попробуем поиграть в The Ship со зрителями, а в 21:00 ожидается Ольгерд (стрим Жмилевского)",2019-06-06,4565,141,2
431,oJqpzoZu8iY,Выборы в Европарламент: последствия и перспективы отношений с Россией (стрим Жмилевского),2019-06-05,4802,188,6
432,tmr9JqLoIiw,Сербия и Косово: конфликт длиною в вечность (стрим Жмилевского),2019-06-02,NULL,NULL,NULL
433,fXc0JZO2dqw,"Подводим итоги встречи в Москве и, может, поиграем во что-нибудь (стрим Жмилевского)",2019-06-01,7889,263,1
434,HSWfFGf9kZA,Bully: scholarship edition и АУКИ - продолжение пажилого марафона (игорстрим Жмилевского),2019-05-30,4210,143,4
435,IXW3zHCuYc0,Пажилой марафон добивания игры SOMA + АУКИ с перерывом на общение с Егором (игорстрим Жмилевского),2019-05-29,6411,198,1
436,jan06bOsPz4,"Прослушка с Маргиналом, Яном и Василом (стрим Жмилевского)",2019-05-27,24728,759,60
437,LX_Q9x4sQRY,Россия и Турция: партнёрство ради мира (стрим Жмилевского),2019-05-25,6423,241,7
438,drCwKCGTOZE,SOMA и запланированные ауки (игорстрим Жмилевского),2019-05-24,4292,181,3
439,_Nft3iX49bc,Эпоха Ельцина начала 90-х годов: дискуссия с Вечным Оппозиционером (стрим Жмилевского),2019-05-22,8546,288,8
440,5pHMQJElyTg,О международных отношениях с командой группы Классический либерал (стрим Жмилевского),2019-05-21,2652,102,1
441,rqsFBqIde6s,О международных отношениях с командой группы Классический либерал (стрим Жмилевского),2019-05-21,NULL,NULL,NULL
442,We7XoPDGU8g,GTA: SAN ANDREAS и внеплановые ауки (спонтанный игорстрим Жмилевского),2019-05-20,NULL,NULL,NULL
443,KH06iATKNOw,Курдистан: история несбывшейся мечты и современная борьба за её исполнение (стрим Жмилевского),2019-05-19,6188,248,12
444,rT236mlkz1s,Афганистан: прерванный полёт к демократии и современное положение дел (стрим Жмилевского),2019-05-18,6509,277,4
445,2uzl2Vq45YU,GTA: SAN ANDREAS и стандартные ауки (игорстрим Жмилевского),2019-05-18,6132,224,5
446,MFLM-SwKE3I,Каджит в гостях у Жмилевского (16/05/2019),2019-05-16,6154,223,3
447,KGTMEtg4pEY,Каджит в гостях у Жмилевского (16/05/2019),2019-05-16,4029,151,3
448,AnKT0B4QF7Q,Россия и СНГ: история взаимоотношений и современное положение дел (стрим Жмилевского),2019-05-15,7531,321,5
449,dT0tKBmGd6c,Ватоадмин vs Сёмин: дебаты у Светова (стрим-разбор Жмилевского),2019-05-14,46745,1342,101
450,KbW6cvWIi6g,Афганистан: история бесконечной войны (стрим Жмилевского),2019-05-08,3402,137,3
451,99cLZQbWXNo,Афганистан: история бесконечной войны (стрим Жмилевского),2019-05-08,10319,393,8
452,lJUW0sJna6o,Корейский кризис: история возникновения и современное состояние (стрим Жмилевского),2019-05-06,9160,355,9
453,rl3URS9Q5Vw,Паспорта для жителей Донбасса: предпосылки и особенности получения (стрим Жмилевского),2019-05-04,5704,259,13
454,6GeuNymobZc,Mafia: The City of Lost Heaven и игро-фильмовые ауки (игорстрим Жмилевского),2019-05-03,6687,236,3
455,ly-2R7NP6fs,Китай: специфика государственного устройства и особенности международных связей (стрим Жмилевского),2019-05-02,NULL,NULL,NULL
456,qCFVo2oCfFk,Кризис в Венесуэле: предпосылки и современное положение (стрим Жмилевского),2019-05-01,7343,318,3
457,emmGfDzQEkw,О международных отношениях с Кириллом Настоящим в качестве гостя (стрим Жмилевского),2019-04-27,NULL,NULL,NULL
458,cads1nF1lio,Mafia: The City of Lost Heaven и игровые ауки (игорстрим Жмилевского),2019-04-27,8013,159,2
459,xYPwgKwfY6Q,Краткий разбор событий 2014 года на Майдане (стрим Жмилевского),2019-04-25,12755,414,14
460,jR2twl2zV58,Дебаты Порошенко и Зеленского (разбор Жмилевского)(без треша после разбора),2019-04-23,24587,897,17
461,HUCDM0ZihVA,Стрим Жмилевского и Храброва,2019-04-22,6899,263,5
462,Mgh4zbFvGCA,Beyond Good &amp; Evil + возможны игровые ауки (игорстрим Жмилевского),2019-04-20,5894,198,0
463,_7zCNjBwagc,Ирано-иракский конфликт в контексте прямого исполнения теории управляемого хаоса (стрим Жмилевского),2019-04-18,1916,67,0
464,9j_bamyD4wI,Ирано-иракский конфликт в контексте прямого исполнения теории управляемого хаоса (стрим Жмилевского),2019-04-18,6967,277,4
465,d1NJaDjdiIM,Краткая история и особенности дипломатии новейшей России (стрим Жмилевского),2019-04-18,10473,405,4
466,OqvR7QlH3A8,Дебаты имени Петра Порошенко с Владимиром Зеленским (стрим-разбор Жмилевского),2019-04-14,NULL,NULL,NULL
467,Tih1nzS3NKE,Большая игра: исторический контекст и современная реальность (стрим Жмилевского),2019-04-14,5500,221,5
468,9uhVAiv94qU,Beyond Good &amp; Evil + игровые ауки (игорстрим Жмилевского),2019-04-12,4971,186,1
469,AJHqPjIpxWM,Последние политические события ближнего и дальнего зарубежья (стрим Жмилевского) - 1 часть,2019-04-10,NULL,NULL,NULL
470,DSia5Oo9bLo,Ливийский конфликт: исторические особенности и современное положение (стрим Жмилевского),2019-04-09,9243,367,14
471,IQQr0KvN2bY,"Beyond Good &amp; Evil (тестовый игорстрим Жмилевского), позже возможен игровой аук",2019-04-06,NULL,NULL,NULL
472,MBqb3jPWJ0w,Сепаратизм [Вебинар Жмилевского],2019-04-05,NULL,NULL,NULL
473,Z7nInTqRgPM,Теракт в Новой Зеландии [обсуждение со Жмилевским],2019-04-04,2553,97,8
474,P2IOJH3n7Mc,Совместный эфир с Василом - Бумерство во все поля (Жмилевский),2019-04-03,8167,314,3
475,OD7KkcO3w5Q,Руандийский конфликт в контексте международного права (Стрим Жмилевского),2019-03-30,3305,171,2
476,QIBh0c5ZgjU,"Основные моменты со стрима Ежи Сармата с Маргиналом, ГромПо, Линком и ITPEDIA (Стрим Жмилевского)",2019-03-30,6560,215,5
477,A0SDIzPFF60,Testing-testing (Стрим Жмилевского),2019-03-28,NULL,NULL,NULL
478,u2MkvhW3Pq8,Крым 2019 [Вебинар Жмилевского],2019-03-25,NULL,NULL,NULL
479,5fUUlsdSyv8,Критика Ельцина и распад СССР [Вебинар Жмилевского],2019-03-24,NULL,NULL,NULL
480,dooHSLUZ0SA,(стрим без модераторов) Итоги Расследования Роберта Мюллера в США [Жмилевский 23/03/19],2019-03-23,4388,160,4
481,HzoW99NdP1Q,Нурсултан Назарбаев [аналитика Жмилевского 21/03/19],2019-03-21,NULL,NULL,NULL
482,a_nGdiKyKy0,УБЕРМАРГИНАЛ И математик (не кодер) НА ПАУЧИТЕЛЬНЫХ ИСТОРИЯХ (ПОСЛЕДНИЙ РАЗ),2019-03-14,NULL,NULL,NULL
483,ZkNKubbIsiw,ЛАМПОВЫЙ УБЕРМАРГИНАЛ В ГОСТЯХ НА ПАУЧИТЕЛЬНЫХ ИСТОРИЯХ,2019-03-06,NULL,NULL,NULL
484,gsGYKe_heAY,"ЕГОР ПОГРОМ, ГРИГОРИЙ БАЖЕНОВ И МАРГО НА ПАУЧИТЕЛЬНЫХ ИСТОРИЯХ",2019-02-27,NULL,NULL,NULL
485,EUlS4mPTS4A,ИГОРЬ ЛИНК И УБЕРМАРГИНАЛ В ГОСТЯХ НА ПАУЧИТЕЛЬНЫХ ИСТОРИЯХ,2019-02-23,NULL,NULL,NULL
486,wKlwtvZ4Glo,ХРИСТИАНСКИЕ ДЕБАТЫ НА ПАУЧИТЕЛЬНЫХ ИСТОРИЯХ,2019-02-22,38343,1014,93
487,-mTHsVV50Ag,"В ГОСТЯХ НА ПАУЧИТЕЛЬНЫХ ИСТОРИЯХ: ВИКТОРИЯ МЕДНИС, ЕГОР ПОГРОМ + УБЕРМАРГИНАЛ",2019-02-20,NULL,NULL,NULL
